0,1,2,3,4,5,6,7
856,purpose,[ˈpɜ:pəs],n.意图，目的,"The purpose of life is a life of purpose.
（Robert Byrne）","生活的目的是有目的地生活。
(罗伯特·伯恩）",,
857,push,[pʊʃ],"n.推（力） v.推；推动；
逼迫",Give the gate a push and it will open.,推一下门就会开的。,,
858,put,[pʊt],v.放，摆,"The exam results will be put up on Friday
afternoon.",这次考试成绩将于星期五下午张贴。,,
859,puzzle,[ˈpʌzl],"n.谜；难题，令人费解的
事",Her behaviour was a puzzle to him.,她的行为对他来说是个谜。,,
860,quality,[ˈkwɒləti],n.质量；品德；性质,"The changes of quantity cause the
changes of quality.（Marx）",量变引起质变。（马克思）,,
861,quantity,[ˈkwɒntəti],n.量，数量；大量,"They were able to produce it in large
quantities.",他们能够大量生产它。,,
862,quarrel,[ˈkwɒrəl],vi./n.争吵,"I had a quarrel with my boss the other
day.",那天我和老板吵了起来。,,
863,question,[ˈkwestʃən],n.问题 vt.质疑；问,I questioned the truth of her story.,我怀疑她的故事是否真实。,,
864,queue,[kju:],n.行列，队 vi.排队,We queued up for the bus.,我们排队等公共汽车。,,
865,quit,[kwɪt],"v.离开，辞职；停止，放
弃","If I don't get more money, I will quit.",不给我加薪，我就辞职。,,
866,quite,,ad.相当，十分,"It's quite warm today, but it's not hot.",今天相当暖和，但并不热。,,
867,race,[reɪs],"n.种族，民族；竞赛，赛
跑 v.跑，同……赛跑","People of different cultures and races
can wear the same kind of clothing.","不同文化和种族的人们可以穿相同的衣
服。",,
868,railway,[ˈreɪlweɪ],n.铁路,"The railway reaches as far as the next
town.",这条铁路一直延伸到下一个城镇。,,
869,rain,[reɪn],vi.下雨 n.雨,It never rains but it pours.,不雨则已，一雨倾盆。/祸不单行。,,
870,raise,[reɪz],"vt.举起；提高；筹募；抚
养","Rise your hand if you know the right
answer.",如果你知道正确答案，请举手。,,
871,range,[reɪndʒ],"n.范围，距离，射程；
列，排；（山）脉 v.变
化；（使）排列成行","The temperature ranges from 25 to 30
degrees centigrade.",温度在 25℃~30℃之间变动。,,
872,rank,[ræŋk],"n.军衔；等级；（社会）
地位","She was not used to mixing with people
of high social rank.","她不习惯和社会地位高的人搅和在一
起。",,
873,rapid,[ˈræpɪd],a.快的，迅速地,He had a rapid recovery from his illness.,他迅速恢复了健康。,,
874,rate,[reɪt],"n.比率；速度；等级；价
格，费用 v.评价，估价；
划分等级","Most people walk at an average rate of
5 kilometers an hour.","大多数人步行的平均速度为每小时 5
千米。",,
875,rather,[ˈrɑ:ðə(r)],ad.相当；宁可,"He would rather keep time for his
hobbies.",他宁愿把时间花在自己的业余爱好上。,,
876,ray,[reɪ],n.光线，射线,He has a gun that fires invisible rays.,他有一支能射出隐形射线的枪。,,
877,reach,[ri:tʃ],"v.到达；拿到；伸出手；
延伸 n.伸手可及的距离","Always remember to put such
dangerous things as knives out of
children's reach.","时刻记住要把像刀子这样的危险物品放
在孩子们够不到的地方。",,
878,react,[riˈækt],"vi.作出反应；回应；起化
学反应","Local residents have reacted angrily to
the news.",当地居民对这一消息表示愤怒。,,
879,read,[ri:d],v.读；理解；写着,"While reading today's newspaper, I read
about the traffic accident.","看今天的报纸时，我读到那次事故的情
况。",,
880,ready,[ˈredi],a.准备好的；乐意的,He is always ready to help his friends.,他总是乐意帮助朋友。,,
881,real,[ˈri:əl],"a.真的，真实的；现实
的，实际的","Love is an ideal thing, marriage a real
thing.（Shakespeare）","爱情是理想，婚姻是现实。
（莎士比亚）",,
882,reality,[riˈæləti],n.真实；现实,"She says she's poor, but in reality she has
a lot of money.",她说她很穷，但事实上她很有钱。,,
883,"realise/-
ze","[ˈri:əlaɪz]/['rɪ
əlaɪz]",vt.认识到；实现,He didn't realize his mistake.,他还没有认识到他的错误。,,
884,really,[ˈri:əli],ad.确实，真正地,He didn't tell us what he really thought.,他没有对我们说出他心中的真实想法。,,
885,reason,[ˈri:zn],n.理由，原因；理性,"The reason why he is absent from work is
that he is ill.",他因病缺勤。,,
886,receive,[rɪˈsi:v],vt.收到，接到,"He received a gift, but he didn't accept
it.",他收到了一件礼物，但他并没有接受。,,
887,recent,[ˈri:snt],a.最近的，近来的,"A lot of research work has been carried
out in recent years.",近年来进行了很多研究工作。,,
888,"recognize
/-ise","[ˈrekəgnaɪ
z]/ ['rekəgna
ɪz]",vt.认出,"I knew the boy several years ago, but
now I can hardly recognize him.","几年前我认识了那个男孩，但是现在我
几乎认不出他了。",,
889,recommend,"[ˌrekəˈ
mend]",vt.推荐；劝告，建议,"She was strongly recommended from
the post.",她获大力推荐担任了这个职务。,,
890,record,[ˈrekɔ:d],"v.记录，记载；录音，录
像 n.记录；纪录；唱片","I recorded the speech made by the
famous player with my recorder.He said
in his speech,"" To set a record is difficult,
but to keep a record is even more
difficult.""","我用录音机将那位著名选手的发言录了
下来。他在发言中说：“创一项记录
难，然而要保住一项纪录更难。”",,
891,recover,[rɪˈkʌvə(r)],"v.恢复，康复；弥补，挽
回","I am now in hospital recovering from
liver failure.","我现在住院了，患的是肝衰竭，正在恢
复中。",,
892,reduce,[rɪˈdju:s],vt.缩小，减少,"Linda reduced her weight by five
kilograms.",琳达的体重减轻了 5 公斤。,,
893,refer,[rɪˈfɜ:(r)],"v.涉及，提到；提交；指
的是；查阅，参考","We agreed never to refer to the matter
again.",我们商定永不再提这件事。,,
894,reflect,[rɪˈflekt],"v.反射；反映，表现；反
省，考虑","He looked at his face reflected in the
mirror.",他看着镜子里自己的脸。,,
895,reform,[rɪˈfɔ:m],vt./n.改革，改良，改造,Many reforms in education are needed.,教育需要大力改革。,,
896,refuse,[rɪˈfju:z],v.拒绝,"She just refuses to stop talking while she
works.",她在工作时老是喋喋不休。,,
897,regard,[rɪˈgɑ:d],"vt.把……看做；注意；尊
重 n.问候；重视；尊敬","In regard to your suggestion, we will
discuss it next time.",关于你的建议，我们下次再讨论。,,
898,regret,[rɪˈgret],n./v.懊悔；遗憾，惋惜,"I regretted to tell him that he had been
dismissed. To my surprise, he said to me,
""I have no regrets.I only regret having
taken the wrong job.""","我遗憾地告诉他他被解雇了。使我惊讶
的是，他对我说：“我没有任何遗憾。
我唯一后悔的是我选错了工作。”",,
899,regular,[ˈregjələ(r)],a.规则的，定期的,We hold regular meetings.,我们定期召开会议。,,
900,relate,[rɪˈleɪt],"v.涉及，与……有关；
将……联系起来",The symbols relate to an earlier system.,这些标志和以前的制度有关联。,,
901,relation,[rɪˈleɪʃn],n.关系；联系；亲属,"There is a close relation between a
proper diet and good health.",均衡饮食和良好的健康有密切的关系。,,
902,relax,[rɪˈlæks],v.(使）松弛，（使）放松,Let your muscles relax slowly.,让你的肌肉慢慢放松。,,
903,relief,[rɪˈli:f],"n.（痛苦等）减轻，缓
解；宽慰，轻松","We all breathed a sign of relief when he
left.","他走了以后，我们大家都如释重负地松
了一口气。",,
904,rely,[rɪˈlaɪ],"vi.依靠，依赖；信赖；指
望",You can rely on me to keep your secret.,你尽管相信我，我一定为你保密。,,
905,remain,[rɪˈmeɪn],"v.保持不变；仍然是；遗
留","The little girl who got lost decided to
remain where she was and wait for her
mother.","这个迷路的小女孩决定待在原地等她的
母亲。",,
906,remember,"[rɪˈmembə
(r)]",vt.记得，想起,"“Remember to return the bat to me.""
""But I remember returning it to you.""","“记得把球拍还给我。”“可是我记得已
经还给你了。”",,
907,remind,[rɪˈmaɪnd],vt.提醒，使想起,"Mary, I reminded John of his promise to
help you.","玛丽，我已经提醒约翰记住他要帮助你
的承诺了。",,
908,remove,[rɪˈmu:v],"vt.拿走；移动；脱掉（衣
服）","Will you remove the vase from the
table?",你可以把花瓶从桌子上拿走吗？,,
909,repair,[rɪˈpeə(r)],vt./n.修理，修补,Can you repair my bike?,您能给我修修自行车吗？,,
910,reply,[rɪˈplaɪ],n./v.回答，答复,"I am writing in reply to your letter of 16
March.",3 月 16 日来函收悉，现答复如下。,,
911,report,[rɪˈpɔ:t],n./v.报告；报道,"It is reported that the population is still
increasing.",据报道人口仍在增加。,,
912,represent,[ˌreprɪˈzent],vt.代表；象征；表现,"The red lines on the map represent
railways.",这张地图上的红线代表铁路。,,
913,reputation,"[ˌrepjuˈteɪʃ
n]",n.名声，声望,"Judge Kelso has a reputation for being
strict but fair.",凯尔索法官以严格公正著称。,,
914,request,[rɪˈkwest],"n.请求；要求的事物；需
要","Passengers are requested not to smoke
on the bus",乘客请勿在公共汽车上吸烟。,,
915,require,[rɪˈkwaɪə(r)],vt.要求；需要,"Most house plants require regular
watering.",大多数室内盆栽植物需要定期浇水。,,
916,research,[rɪˈsɜ:tʃ],n./v.调查，研究,"We are searching the forest for the lost
boy while they are researching into a
maths problem.","我们在森林里寻找丢失的男孩，而他们
在探索数学难题。",,
917,resist,[rɪˈzɪst],v.抵抗；忍住；抗，耐,"He couldn't resist showing off his new
car.",他忍不住炫耀起了他的新车。,,
918,respect,[rɪˈspekt],vt./n.敬重，尊敬,Everyone should respect his teachers.,每个人都应该尊敬老师。,,
919,respond,[rɪˈspɒnd],vi.(to)回答，答复；响应,She never responded to my letter.,她从来没给我回过信。,,
920,responsibility,"[rɪˌspɒnsəˈb
ɪləti]","n.责任（心）；职责，义
务",I feel great responsibility for it .,我对这件事感到责任重大。,,
921,rest,[rest],"n.休息；剩余的人/物；安
静，安宁 vi.休息，歇息","The first question was difficult,but the rest
were pretty easy.","第一个问题很难，但其余的都相当简
单。",,
922,restaurant,[ˈrestrɒnt],n.餐馆,There is a newly-built restaurant here.,这里有一家新建的餐馆。,,
923,result,[rɪˈzʌlt],n.结果；效果 vi.造成,"It doesn't often rain in summer here. As a
result,we have to water the vegetable
garden.","这儿夏天不常下雨，因此，我们不得不
给菜园浇水。",,
924,retire,[rɪˈtaɪə(r)],vi.(from)退休；撤退,She retired early from teaching.,她从教学岗位上提前退休了。,,
925,return,[rɪˈtɜ:n],v./n.归还；返回；回报,"We give dogs time,space and love we
can spare ,and in return,dogs give us
their all.","我们把所能匀出的时间、空间和关爱给
狗，作为回报，狗把它们的一切给了我
们。",,
926,review,[rɪˈvju:],"vt.复习；复查；回顾；评
论","Let's review what we have learned in
this lesson.",咱们把本课所学的内容复习一下吧。,,
927,revolution,[ˌrevəˈlu:ʃn],n.革命,"Many people were killed in the
revolution.",很多人在革命中丧生。,,
928,reward,[rɪˈwɔ:d],n.报酬；奖赏，报答,"He received a medal in reward for his
bravery.",他因表现勇敢获得了一枚奖章。,,
929,rich,[rɪtʃ],"a.有钱的，富裕的；富饶
的",Our country is rich in natural resources.,我们国家自然资源丰富。,,
930,ride,[raɪd],"v./n.骑（马、自行车
等）；乘（车、船等）",She was riding a bicycle.,她在骑自行车。,,
931,right,[raɪt],"ad.正好；恰当地；完全
地 a.右边的；对的，正确
的 n.右边；权利","It's right of him to put up his right hand at
the right time.",他在适当的时候举起右手是对的。,,
932,ring,[rɪŋ],"v.（钟、铃）响；打电话
n.打电话；铃声；戒指",Can I ring back later？,我能过会儿再回电话吗？,,
933,ripe,[raɪp],a.成熟的，熟的,"Autumn is coming. Everything is ripe and
even our love is mature in such a
harvesting season.","秋天到了！一切都成熟了！我们的爱情
也在这收获的季节成熟了。",,
934,rise,[raɪz],vi./n.上升，增长,"On Monday morning, we were watching
the children raising the national flag, and
we saw it rising slowly in the wind.","星期一早上，我们在观看孩子们升国
旗。我们看到国旗在风中冉冉升起。",,
935,risk,[rɪsk],"vt.冒……的危险 n.危险，
风险",He risked his life to save her.,他冒着生命危险去救她。,,
936,road,[rəʊd],n.路，公路；途径，方法,The soldiers marched along the road.,士兵们沿着大路前进。,,
937,rob,[rɒb],vt.(of)抢劫，抢夺；剥夺,They robbed him of all his money.,他们抢走了他所有的钱。,,
938,rock,[rɒk],n.岩石 v.摇动，摇晃,The ship rocked in the storm.,船在暴风雨中颠簸。,,
939,role,[rəʊl],n.角色；作用,"Today, players from China play a leading
role in the international table tennis
competition.","今天，来自中国的选手在国际乒乓球比
赛中发挥着主导作用。",,
940,roll,[rəʊl],"v.(使）滚动；（使）翻身
vt.卷起 n.滚动；面包卷；
卷状物",The car was rolling along smoothly.,车子平稳前进。,,
941,roof,[ru:f],n.屋顶；顶，顶部,The roofs of our school houses are red.,我们校舍的屋顶是红色的。,,
942,room,[ru:m],n.房间；空间,"“Is there（ any ）room for me to sit
down here？”“ Yes, there's a place in
the corner.”","“这儿有我坐的地方吗？”“是的，在角
上有。”",,
943,root,[ru:t],n.根；根源，起源,Love of money is the root of all evil.,贪财是万恶之源。,,
944,rough,[rʌf],a.粗糙的,Her skin felt rough.,她的皮肤摸上去粗糙。,,
945,round,[raʊnd],"a.圆的 ad.旋转；围绕；
到处 prep.围绕；在……周
围",The earth moves round the sun.,地球围绕太阳旋转。,,
946,routine,[ru:ˈti:n],"a.例行的，常规的 n.例行
公事，惯例","Teachers in our school will have a
routine medical examination on
teachers ' day.","教师节的时候我们学校的教师要进行常
规体检。",,
947,row,[rəʊ],n.排，行；划船 v. 划船,Let's go for a row on the lake.,我们去湖上划船吧！,,
948,rude,[ru:d],a.无礼的，粗鲁的,"Tom was punished because he was rude
to his teacher.",汤姆对老师无礼，所以受到处罚。,,
949,ruin,[ˈru:ɪn],"vt.（使）毁坏，毁灭
n.[pl.]废墟，遗迹","Don't let small disagreements ruin your
friendship.","不要让微不足道的分歧毁掉了你们之间
的友谊。",,
950,rule,[ru:l],"n.规则，规定；统治 vt.统
治，支配",At that time John ruled England.,当时是约翰统治着英格兰。,,
951,run,[rʌn],"v.跑，奔；操作；经常，
管理","Time is running out for the trapped
miners.",被困矿工的时间不多了。,,
952,rush,[rʌʃ],vi.冲，奔；仓促行动,"We've got plenty of time. There's no need
to rush.",我们的时间很多，用不着太急促。,,
953,sacrifice,[ˈsækrɪfaɪs],vt./n.牺牲,"A mother will sacrifice her life for her
children.",母亲会为自己的孩子操劳一生。,,
954,sad,[sæd],"a.（令人）悲伤的，（让
人）难过的",He is very sad about his cat's death.,他的猫死了，她感到很难过。,,
955,safe,[seɪf],"a.安全的；保险的；平安
的 n.保险柜",The children returned safe.,孩子们平安归来。,,
956,safety,[ˈseɪfti],n.安全；保险,I am worried about his safety.,我担心他的安全。,,
957,sail,[seɪl],n.乘船航行 vi.航行，行驶,Let's go for a sail this afternoon.,我们今天下午坐船旅行吧。,,
958,sailor,[ˈseɪlə(r)],n.海员，水手,"Her father was a sailor when he was
young.",她父亲年轻时是个水手。,,
959,sale,[seɪl],n.卖，出售；廉价出售,They've put their house up for sale.,他们的房子现在出售。,,
960,salt,[sɔ:lt],n.盐,"Too much salt is not good for your
health.",摄取过多的食盐对健康不利。,,
961,same,[seɪm],"a.同一的，同样的 pron.
同样的人/物","It's the same with classical Chinese
music.",中国古典音乐也是一样。,,
962,satellite,[ˈsætəlaɪt],n.（人造）卫星,The moon is a satellite of the earth.,月球是地球的卫星。,,
963,satisfaction,"[ˌsætɪsˈfækʃ
n]",n.满足，满意,"She finished painting the picture and
looked at it with satisfaction.",她画完那幅画，看了看觉得很满意。,,
964,satisfy,[ˈsætɪsfaɪ],vt.使满意；使确信,"Nothing satisfies him——he's always
complaining.",什么都难如他的意——他老是在抱怨。,,
965,save,[seɪv],vt.救，挽救；节省，储蓄,He saved the child from drowning.,他救起了那个溺水儿童。,,
966,say,[seɪ],vt.说，讲,Don't believe anything he says.,他说的任何事情都不要相信。,,
967,saying,[ˈseɪɪŋ],n.俗话，谚语,"Jane was fond of quoting the sayings of
philosophers.",简喜欢引用哲人的话。,,
968,scare,[skeə(r)],"n.惊恐，恐慌 v.使惊恐；
易受惊吓",The thunder scared the children.,雷声使孩子们受到了惊吓。,,
969,scene,[si:n],"n.（戏剧、电影等的）一
场；景色；场面","The meeting was held behind the
scenes.",会议是秘密召开的。,,
970,schedule,[ˈʃedju:l],"n.时间表，进度表 vt.安
排，预定","What is the schedule of the half-day
tour?",半日游的行程如何安排？,,
971,school,[sku:l],n.学校；学派,Which school do you go to?,你上的是哪所学校？,,
972,science,[ˈsaɪəns],n.科学,"Science advances the boundaries of
knowledge.",科学扩展了知识的范围。,,
973,scientific,"[ˌsaɪənˈtɪfɪ
k]",a.科学的,"We should take a scientific approach to
problems.",我们应以科学的方法研究问题。,,
974,scientist,[ˈsaɪəntɪst],n.科学家,"The scientist abandoned his research for
lack of fund.","由于缺乏资金，这位科学家放弃了他的
研究。",,
975,scold,[skəʊld],vt.斥责,I scold him for having left the door open.,我责备他没有关门。,,
976,score,[skɔ:(r)],"n.（比赛）得分；二十 v.
得（分）","Add up your score for each type of
intelligence.","把每一种智力赛中你得到的分数加起
来。",,
977,scream,[skri:m],n./v.尖叫,She let out a scream of terror.,她发出恐怖的尖叫声。,,
978,sea,[si:],"n.海，海洋；大量，茫茫
一片",The storm interrupted all travel by sea.,暴风雨中断了所有的海上航行。,,
979,search,[sɜ:tʃ],n./v.搜查，搜索，寻找,Mark went in search of water.,马克去找水了。,,
980,season,[ˈsi:zn],n.季节；旺季，活跃季节,"The four seasons are spring, summer,
autumn and winter.",四季为春、夏、秋、冬。,,
981,seat,[si:t],n.座位 vt.使就座,"After I was seated at the back of the
classroom, I saw some villagers sitting
there too.","我在教室后面坐下来，看见一些村民也
坐在那儿。",,
982,second,[ˈsekənd],n.秒 a.第二的 num.第二,Every second counts.,分秒必争。,,
983,secret,[ˈsi:krət],n./a.秘密（的）,"A secret comer told me to keep the
secret in secret in a secret place.","一个神秘的人在秘密地点秘密地告诉我
要保守这个秘密。",,
984,secretary,[ˈsekrətri],n.秘书,Miss Li is employed as a secretary.,李小姐被聘为秘书。,,
985,secure,[sɪˈkjʊə(r)],"a.安全的，可靠的，放心
的；稳固的 vt.获得；保
护，保卫","Every citizen has the right to live a
peaceful and secure life.","每个公民都有权过上和平、安定的生
活。",,
986,see,[si:],v.看见；领会；拜访,Seeing is believing.,眼见为实。,,
987,seed,[si:d],n.种子,This tree produces seeds in the fall.,这棵树在秋天结籽。,,
988,seek,[si:k],v.寻找；试图,"Local schools are seeking to reduce the
dropout rate.",当地学校在寻找办法降低辍学率。,,
989,seem,[si:m],vi.好像，看起来,Everything seemed easy.,看来一切都不难。,,
990,seize,[si:z],vt.抓住（时机等）,"Seize the day, seize the hour.",只争朝夕。,,
991,seldom,[ˈseldəm],ad.很少，不常,He seldom eats any breakfast.,他很少吃早餐。,,
992,sell,[sel],v.卖，出售,I want to sell the car.,我想卖掉这辆车。,,
993,send,[send],vt.送；派遣；邮寄,"I will send my son to you with my
message.",我会让我儿子带口信给你。,,
994,senior,[ˈsi:niə(r)],"a.资格老的，地位较高
的；年长的 n.（大学）四
年级学生；较年长者",My brother is senior to me by two years.,我哥哥比我年长两岁。,,
995,sense,[sens],n.感觉；判断力,"A sense of panic has spread over the
country.",举国上下一片恐慌。,,
996,sentence,[ˈsentəns],n.句子 vt.宣判，判决,He was sentenced to death for murder.,他因谋杀而被判死刑。,,
997,separate,[ˈseprət],"a.分离的；单独的 v.
（使）分开，分离","Separate the good ones from the bad
ones.",把好的和坏的分开。,,
998,serious,[ˈsɪəriəs],"a.严肃的，认真的；严重
的",He is serious about giving up smoking.,他真想戒烟。,,
999,servant,[ˈsɜ:vənt],n.仆人，佣人,"Money is a good servant but a bad
master.",金钱是善仆，却是恶主。,,
1000,serve,[sɜ:v],v.（为……）服务；招待,The waiter served him a glass of beer.,服务员给他端上一杯啤酒。,,
1001,service,[ˈsɜ:vɪs],n.服务,"If you need any help, I and my car are
at your service.","你需要帮助的话，我和我的车随时侍
候。",,
1002,set,[set],"vt.放，置；设置（戏剧、
小说等的）背景；落下 n.
（一）套；布景","They set up on the last stage of their
journey.",他们动身踏上最后一段行程。,,
1003,settle,[ˈsetl],"v.解决；安家，定居；决
定",The family has settled in Canada.,这家人已定居加拿大。,,
1004,several,[ˈsevrəl],"det./pron.几个，数个，
一些",I have several friends in the town.,我在城里有几个朋友。,,
1005,sew,[səʊ],v.缝补,I've sewn your button on again.,我把你的扣子又钉上了。,,
1006,sex,[seks],n.性，性别,"Love is a matter of chemistry； sex is a
matter of physics.","爱是化学问题，性是物理问题。
（卡森）",,
1007,shade,[ʃeɪd],n.阴凉处，树荫,"Some flowers do better in shade than in
direct sunlight.","有些花在阴凉的地方长得比直接受日照
时好。",,
1008,shadow,[ˈʃædəʊ],n.阴影，影子,"The shadows of the trees grew longer as
the afternoon went on.","随着下午时光的延续，树影变得越来越
长。",,
1009,shake,[ʃeɪk],v.摇动；震动,She shook her head in disbelief.,她摇摇头，不相信。,,
1010,shall,[ʃəl],"modal v.（表示将来）
（我/我们）将会，
会；……好吗",What shall we do tomorrow?,我们明天要做什么呢？,,
1011,shallow,[ˈʃæləʊ],a.浅的；浅薄的,She proved to be a shallow person.,她原来是个肤浅的人。,,
1012,shame,[ʃeɪm],n.羞愧；遗憾的事,"She bowed her head （down） in
shame.",她羞愧地低下头来。,,
1013,shape,[ʃeɪp],n.形状 vt.形成；使成型,Shape the dough into small balls.,把面团搓成小圆球。,,
1014,share,[ʃeə(r)],v.分享，共同使用；分担,I shared my umbrella with him.,我与他合撑一把伞。,,
1015,sharp,[ʃɑ:p],"a.锋利的，尖的；急剧
的，猛烈的；尖酸的；敏
锐的","Nowadays, there is a sharp increase in
children's creativity.",如今孩子们的创造力急剧提升。,,
1016,shave,[ʃeɪv],"v.剃，刮（胡须等）；刮
脸",Bill has shaved his beard off.,比尔已刮掉了胡子。,,
1017,sheep,[ʃi:p],n.[单同复]羊，绵羊,"A spoiled lamb will become an
overbearing sheep.",儿时受宠，成人蛮横。,,
1018,sheet,[ʃi:t],n.床单；纸张;薄片,He put clean sheets on the bed.,他把干净的床单铺在床上。,,
1019,shelf,[ʃelf],n.架子，搁板,"We will have to put up some more
shelves for all these books.","我们该为这些书再装几块（书架）搁
板。",,
1020,shine,[ʃaɪn],"v.（shone,shone)照耀；
发光；(shined,shined)擦
亮 n.光泽；阳光","Behind him the moon shone down over
green hills.",在他的身后，月光照射在青山上。,,
1021,shock,[ʃɒk],vt.使震惊；电击,We were shocked at the news.,那个消息令我们震惊。,,
1022,shoot,[ʃu:t],"v.射击，射中，射死；发
芽 n.射击；嫩芽","The rabbit eating shoots on the grass
was shot.",正在草地上吃草的兔子被射死了。,,
1023,shop,[ʃɒp],n.商店 vi.买东西，购物,Mary always shops in that store.,玛丽总在那家商店购物。,,
1024,shore,[ʃɔ:(r)],n.岸，滨,"He has a house on the shores of the
lake.",他在湖畔有一栋房子。,,
1025,short,[ʃɔ:t],a.短的；矮的；缺乏的,"The boy is too short to reach the pears
on the tree.",这个男孩个子太矮，够不到树上的梨。,,
1026,shot,[ʃɒt],"n.发射，射击；射门，投
篮","The bird was wounded by a shot in the
left wing.",那只鸟左翅被射伤。,,
1027,should,[ʃʊd],"v.（shall的过去式）将
要；应该；可能",They should arrive soon.,他们应该快到了。,,
1028,shoulder,[ˈʃəʊldə(r)],n.肩膀 vt.肩负,"As a leader，you should shoulder the
duties of yourself.","作为一个领导，你应该负起你应负的责
任。",,
1029,shout,[ʃaʊt],n./v.喊，高呼,"The audience shouted the speakers
down.","听众向那名演说者喝倒彩，使他停止说
话。",,
