0,1,2,3,4,5,6,7
1,,a(an),[ə] 、 [ən],art. 一（个，件）,"An hour ago, a European bought an
MP3.",1 小时前，一位欧洲人买了一个 MP3。,
2,,abandon,[əˈbændən],vt.放弃，抛弃;,"He abandoned his wife and children
and went away with all their money.",他抛妻弃子，并带走了所有的钱。,
3,,ability,[əˈbɪləti],n.能力；才能；才智,"He completed the job to the best of his
ability.",他尽全力完成了工作。,
4,,able,[ˈeɪbl],a.能够的；有能力的,The child is not yet able to write.,这个孩子还不会写字。,
5,,about,[əˈbaʊt],"ad.大约；到处 prep.关
于；在……的各处","We were just about to leave when Jerry
arrived.",我们正要离开，杰里来了。,
6,,above,[əˈbʌv],"prep.在……上面 a.上面
的 ad.在上面",The plane is flying above the clouds.,飞机在云层上空飞行。,
7,,abroad,[əˈbrɔ:d],ad.到/在国外,"Whether he has been abroad or not
doesn't make much difference.",他是否出过国关系不大。,
8,,absence,[ˈæbsəns],"n.缺席，不在；缺乏，
不存在","In the absence of any evidence,the
police had to let Myers go.",警察没有证据，只好把迈尔斯放了。,
9,,absent,[ˈæbsənt],"a.（from）缺席的，不
在的；缺乏的","Love was totally absent from his
childhood.",他童年时完全没有得到关爱。,
10,,absorb,[əbˈsɔ:b],vt.吸收；吸引，使专心,He was absorbed in watching TV.,他在全神贯注地看电视。,
11,,abstract,[ˈæbstrækt],a.抽象的 n.摘要，概要,"A flower is beautiful,but beauty itself is
abstract.",花是美的，可美是抽象的。,
12,,academic,[ˌækəˈdemɪk],"a.学业的；学术的 n.大
学教师","The new academic year begins in
September.",新学年从九月份开始。,
13,accept,[əkˈsept],vt.接受，认可,"I refuse to accept the blame for
something that was someone else's fault","我拒绝接受由于别人的过错而导致的对
我的责备。",,
14,access,[ˈækses],"n.通道，入口；（使用
或见到的）机会，权利
vt.存取（计算机文件）","The system has been designed to give
students quick and easy access to the
digital resources of the library.","设计这个系统就是为了让学生快速而轻
松地使用图书馆的数字资源",,
15,accessible,[əkˈsesəbl],"a.(to)可使用的，可见到
的，易接近的","These documents are not accessible to
the public.",公众无法看到这些文件。,,
16,accident,[ˈæksɪdənt],n.事故；意外事件,The accident happened at 3 p.m.,事故发生于下午 3 点。,,
17,account,[əˈkaʊnt],"n.叙述；账户 vi.(for)说
明（原因等）；占（一
定数量或比例）","He was absent from school on account
of illness.",他因病不能去上学。,,
18,accuse,[əˈkju:z],vt.控告；谴责，指责,They accuse him of stealing the car.,他们控告他偷了那辆车。,,
19,ache,[eɪk],vi.疼 n.疼痛,I have an ache in my stomach.,我胃疼。,,
20,achieve,[əˈtʃi:v],vt.达到，完成,He had finally achieved success.,他终于获得了成功。,,
21,acknowledge,[əkˈnɒlɪdʒ],"vt.承认；告知（信件、
礼物等）已收到；对
（礼物等)表示感谢","Yao Ming was widely acknowledged as
one of the best players in the world.",姚明是公认的世界最佳运动员之一。,,
22,across,[əˈkrɒs],"prep./ad.横过，穿过；
在另一边，在对面","The Great Wall winds its way from west to
east,across the deserts,over the
mountains,through the valleys,till at last it
reaches the sea.","长城从西到东蜿蜒而行，穿过沙漠，越
过高山，跨过山谷，最后到达大海。",,
23,act,[ækt],"v.行动，做事；举动；
扮演（角色）；起作用
n.行为；法令",Think carefully before you act.,[谚]三思而后行。,,
24,actual,[ˈæktʃuəl],a.实际的，真实的,"The actual cost was much higher than
we had expected.",实际成本比我们预计的要高得多。,,
25,adapt,[əˈdæpt],v.（使）适应；改编,"She adapted herself quickly to the new
climate.",她很快就适应了这种新气候。,,
26,add,[æd],"v.加；增加；进一步说/
写","The wonderful songs added to our
pleasure.",悦耳的歌曲给我们增添了欢乐。,,
27,address,[əˈdres],n.地址；演讲,"Write down your name and
address,please.",请写下你的姓名和地址。,,
28,adjust,[əˈdʒʌst],v.调节，调整；适应,"It took a few seconds for her eyes to
adjust to the darkness.",过了几秒钟她的眼睛才适应了黑暗。,,
29,admire,[ədˈmaɪə(r)],vt.钦佩；羡慕；欣赏,I admire John for his courage.,我钦佩约翰的勇气。,,
30,admit,[ədˈmɪt],"vt.承认；准许进入/加
入","Will you admit having broken the
window？",你承认你打破了窗户吗？,,
31,adopt,[əˈdɒpt],"vt.收养，领养；采用，
采纳",Sally was adopted when she was four.,萨莉 4 岁时被人收养。,,
32,adult,[ˈædʌlt],n./a.成（年）人（的）,Don't cut in while adults are talking.,大人讲话时不要插嘴。,,
33,advance,[ədˈvɑ:ns],v./n.推进；前进；进步,"It's cheaper if you book the tickets in
advance.",提前订票要便宜一些。,,
34,advantage,[ədˈvɑ:ntɪdʒ],n.优点；好处,"Living in a big city has many
advantages.",住在大城市里有很多有利条件。,,
35,adventure,[ədˈventʃə(r)],n.冒险；奇遇,"He told me about all his adventures at
sea.",他给我讲了他所有的海上奇遇。,,
36,advertise,[ˈædvətaɪz],v.（为……）做广告,Mr.Lin advertised his goods.,林先生为他的商品做广告。,,
37,advice,[ədˈvaɪs],"n.（on,about)忠告，劝
告；建议","Could you give me some advice about
buying a house？","你能不能给我提一点关于买房子的建
议？",,
38,advise,[ədˈvaɪz],vt.忠告，劝告；建议,I advised that he (should) start at once.,我建议他立刻动身。,,
39,advocate,[ˈædvəkeɪt],"vt.鼓吹，拥护，提倡 n.
鼓吹者，拥护者，提倡
者","This party advocates a reduction in
taxes.",这个政党主张削减税收。,,
40,affair,[əˈfeə(r)],n.事件，事情；事务,Mind your own affairs!,别管闲事！,,
41,affect,[əˈfekt],vt.影响；打动,"The climate affects the amount of the
rainfall.",气候影响降雨量。,,
42,afford,[əˈfɔ:d],"vt.负担得起（费用）；
抽得出（时间）；提供","we can't afford to go on vacation this
year.",今年我们没钱去度假。,,
43,afraid,[əˈfreɪd],a.害怕的；担心的,"Mr. Black was afraid to climb the tree，
for he was afraid of falling down from it.","布莱克先生不敢爬树，因为他怕从树上
掉下来。",,
44,after,[ˈɑ:ftə(r)],"prep./conj.在……之后；
在……后面 ad.之后，后
面","After a few days he came back , but he
said he would leave again in a few days.","几天后他回来了。可他说他将在几天后
再度离开。",,
45,afternoon,[ˌɑ:ftəˈnu:n],n.下午，午后,Please call me in the afternoon.,请在下午给我打电话。,,
46,afterward,['ɑ:ftəwəd],ad.后来，以后,You will regret it afterwards.,你以后会后悔的。,,
47,again,[əˈgen],ad.又，再，再一次,"Say it again , please.",请再说一遍。,,
48,against,[əˈgenst],prep.与……相反；反对,"Although against my opinion, the old
professor didn't come up with his own.","老教授尽管反对我的意见，却没有提出
自己的意见。",,
49,ago,[əˈgəʊ],ad.以前,"Two days ago, I went to see him, but his
neighbour said that he had left four
days before.","两天前我去拜访他，可他的邻居说他在
四天前就走了。",,
50,agree,[əˈgri:],"v.同意，赞成；约定；
答应","When Tom asked me if my wife agreed
to spend the holiday in the north, I said
that she agreed to my idea. So we
agreed on a date for it，and my wife
agreed with what we did.","汤姆问我我太太是否也同意去北方度假
时，我说她同意我的想法。因此我们就
定了个日子，我太太对我们的做法表示
同意。",,
51,agriculture,"[ˈægrɪkʌltʃə
(r)]",n.农业,"The meeting concerns trade and
agriculture.",会议内容涉及贸易和农业。,,
52,ahead,[əˈhed],ad.在前面；向前；提前,Tom is running ahead of me.,汤姆跑在我前面。,,
53,aid,[eɪd],vt./n.帮助，援助，救援,"A large number of volunteers went to
the disaster area to aid the sufferers.",很多志愿者奔赴灾区救助受灾群众。,,
54,aim,[eɪm],"n.目标；目的
v.(at,for,to)瞄准，对
准；旨在；企图，力求","These measures are aimed at reducing
road accidents.",这些措施旨在减少道路交通事故。,,
55,air,[eə(r)],n.空气，大气；气氛,Listen，my favourite song is on the air.,听，广播里放的是我最喜欢的歌。,,
56,aircraft,[ˈeəkrɑ:ft],n.[单同复]飞机,The aircraft was made in France.,这架飞机是法国制造的。,,
57,airport,[ˈeəpɔ:t],n.机场，航空站,"The plane circled the airport before
landing.",飞机着陆前在机场上空盘旋。,,
58,alarm,[əˈlɑ:m],"n.警报（器）；惊恐 vt.
使惊恐",She decided to sound the alarm.,她决定发出警报。,,
59,alive,[əˈlaɪv],"a.活着的；继续存在
的；有活力的，有生气
的","But anyone who is alive in the world of
the living has some hope ，a live dog is
better than a dead lion.","的确，任何人只要与活着的人在一起就
还会有一丝生的希望。所以，比起死了
的狮子，活着的狗要更好一些。",,
60,all,[ɔ:l],"a.所有的 ad.完全 pron.
全部，全体","You shouldn't have scolded the boy at
all，he is a child after all； above all, he
made only two mistakes in all.","你本不该责备那个男孩，他毕竟还是个
孩子；毕竟，他总共才出了两处错。",,
61,allow,[əˈlaʊ],vt.准许，允许,"The nurse allowed him to remain
there,though it was not permitted.","护士允许他留在那里，虽然这是（规
定）所禁止。",,
62,almost,[ˈɔ:lməʊst],ad.几乎，差不多,Supper's almost ready.,晚饭就要做好了。,,
63,alone,[əˈləʊn],a./ad.单独，独自,It's hard bringing up children alone.,独自抚养孩子是艰难的。,,
64,along,[əˈlɒŋ],"ad.向前；一道，和……
一起 prep.沿着，顺着","""Move along, please! ""said a police
officer.",“请往前走！”一位警官说道。,,
65,aloud,[əˈlaʊd],ad.大声地,"My English teacher suggested that I
should read aloud every day.",我的英语老师建议我每天朗读。,,
66,already,[ɔ:lˈredi],ad.已经,"This time tomorrow I'll already be in
Tokyo.",明天这个时候我已经在东京了。,,
67,also,[ˈɔ:lsəʊ],ad.也,"The system was not only complicated
but also ineffective.",这套系统不仅复杂而且效率低下。,,
68,although,[ɔ:lˈðəu],conj.尽管；然而,"Although the sun was shining, it wasn't
very warm.",尽管太阳高照，却不很暖和。,,
69,altogether,[ˌɔ:ltəˈgeðə(r)],"ad.完全；总共；总而言
之",I don't altogether agree with you.,我不完全同意你的意见。,,
70,always,[ˈɔ:lweɪz],"ad.总是，一直；（将）
永远",He is always asking silly questions.,他总问一些愚蠢的问题。,,
71,amaze,[əˈmeɪz],vt.使惊奇，使惊愕,"It still amazes me how much she has
improved.",她进步很大，至今仍让我惊讶。,,
72,ambition,[æmˈbɪʃn],n.雄心；野心；夙愿,Ambition never has its fill.,欲望永无止境。,,
73,among,[əˈmʌŋ],"prep.(通常指三者或三者
以上）在……之中","A British woman was among the
survivors.",幸存者中有一位英国妇女。,,
74,amount,[əˈmaʊnt],"n.数量，数额 vi.(to)合
计，总计达；等于，接
近",His debts amount to over $1000.,他欠债总额已超过 1000 美元。,,
75,amuse,[əˈmju:z],"vt.逗笑，逗乐；（使）
娱乐",He amused himself by playing the violin.,他以拉小提琴来自娱自乐。,,
76,analyse,[ˈænəlaɪz],vt.分析，分解,She still needs to analyze the data.,她仍需要分析这些数据。,,
77,and,[ənd],conj.和，又，而且,She's a professor and scientist.,她是教授，又是科学家。,,
78,anger,[ˈæŋgə(r)],n.生气，愤怒,They were filled with anger at the news.,听了这个消息，他们满腔怒火。,,
79,angry,[ˈæŋgri],a.愤怒的，生气的,"The world needs anger. The world often
continues to allow evil because it isn't
angry enough.","世界需要愤怒。世界往往因为不够愤怒
而继续允许罪恶存在。（伯达·杰瑞）",,
80,animal,[ˈænɪml],n.动物,The dolphin is a smart animal.,海豚是聪明的动物。,,
81,announce,[əˈnaʊns],vt.宣告，宣布,"They haven't formally announced their
engagement yet.",他们还没有正式宣布订婚。,,
82,annoy,[əˈnɔɪ],vt.使恼怒，使生气,"His constant joking was beginning to
annoy her.",他不停地开玩笑，已开始惹她生气。,,
83,another,[əˈnʌðə(r)],"pron.另外一个；再一，
又一",Won't you have another cup of tea?,你不再喝一杯茶吗？,,
84,answer,[ˈɑ:nsə(r)],"v./n.回答，答复；（给
出）答案","""Can you answer this question?"" ""No, I
can't. I don't think there is any quick
answer to it.""","“你能回答这个问题吗？”“不，我不
能。我认为不能很快就给出这个问题的
答案。”",,
85,anxious,[ˈæŋkʃəs],a.忧虑的；渴望的,"She was anxious about the coming
exam.",她非常担心即将到来的考试。,,
86,any,[ˈeni],"det.任一；任何的 pron.
无论哪一个，无论哪
些；任何数量，任何数
额",Correct the errors in his report， if any.,如果他的报告中有错误，请改正。,,
87,anyhow,[ˈenihaʊ],ad.不管怎样；无论如何,The door won't open anyhow.,这门无论如何也打不开。,,
88,anyone,[ˈeniwʌn],pron.任何人，无论谁,Anyone could win tonight.,今晚任何人都可能赢。,,
89,anything,[ˈeniθɪŋ],"pron.任何事（物），无
论什么","She did nothing but sing, but she is
anything but a singer.","她一个劲地唱歌，但她根本不是歌唱
家。",,
90,anyway,[ˈeniweɪ],ad.尽管如此，无论如何,"I'm afraid we can't come, but thanks for
the invitation anyway.",恐怕我们来不了，不过还是感谢邀请。,,
91,anywhere,[ˈeniweə(r)],ad.任何地方，无论哪儿,Did you go anywhere last Sunday?,上星期天你去哪儿了？,,
92,apart,[əˈpɑ:t],ad.撇开；分开；相距,"Apart from good service, the restaurant
offers different kinds of traditional Fujian
dishes.","除了优质的服务，这家饭店还提供各种
各样的福建传统菜肴。",,
93,apartment,[əˈpɑ:tmənt],"n.(BrE)房间，套间；
（AmE)公寓",She lives in a small apartment.,她住在一套小公寓里,,
94,apologize,[əˈpɒlədʒaɪz],vi.道歉，认错,He later apologized for his behaviour.,他后来为他的行为道了歉。,,
95,appear,[əˈpɪə(r)],"vi.出现，显现；看来
（好像），似乎","It appears to me that he will win the
prize.",我觉得他可能会得奖。,,
96,appearance,[əˈpɪərəns],n.出现，露面；外貌,His sudden appearance surprised me.,他突然出现，使我感到惊讶。,,
97,apply,[əˈplaɪ],v.申请；适用；应用,"Peter applied for British citizenship last
year.",彼得去年申请了英国国籍。,,
98,appointment,[əˈpɔɪntmənt],n.约定，约会；任命,"Tom cancel led the appointment with
his doctor because of the date with his
girlfriend.","汤姆因为与女朋友的约会而取消了与医
生的见面。",,
99,appreciate,[əˈpri:ʃieɪt],vt.感谢；欣赏,"The foreigner enjoys Beijing Opera very
much, although he does not appreciate
it.","这个外国人很爱听京剧，虽然他听不出
个子丑寅卯。",,
100,approach,[əˈprəʊtʃ],"v.靠近，接近，临近 n.
接近；方法，途径","I like her approach to solving the
problem.",我喜欢她解决这个问题的方法。,,
101,approve,[əˈpru:v],v.赞成，同意；批准,"Mr.Bally approved of my attending the
conference.",贝利先生同意我参加会议。,,
102,area,[ˈeəriə],"n.地区，区域；面积；
领域",What's the area of Taiwan?,台湾的面积有多大？,,
103,argue,[ˈɑ:gju:],v.争吵；争辩，争论,"Gun control is a subject about which
Americans have argued for a long time.","枪支控制是很长时间以来美国人一直争
论的话题。",,
104,arise,[əˈraɪz],"vi.出现；由……引起；
起来；升起",Accidents often arise from carelessness.,事故往往起因于粗心。,,
105,arm,[ɑ:m],"n.臂，臂状物；[pl.]武器
v.武装，装备","Arms badly hurt，he had to lay down his
arms.",双臂受了重伤，他不得不放下武器。,,
106,around,[əˈraʊnd],"prep.在……周围；大约
ad.在附近，在周围；到
处，四周","He looked around, but saw nothing.",他环视四周，但什么也没看见。,,
107,arrange,[əˈreɪndʒ],v.安排；布置,The party was arranged quickly.,聚会很快就安排好了。,,
108,arrest,[əˈrest],vt./n.逮捕，拘留,The thief was arrested by the police.,那个贼被警察逮捕了。,,
109,arrive,[əˈraɪv],vi.到达，抵达,We arrived home late in the evening.,我们晚上很晚才回到家。,,
110,as,[əz],"conj.当……时；如同；
因为 prep.作为 ad.一样
地",Do in Rome as the Romans do.,[谚]入乡随俗。,,
111,ask,[ɑ:sk],"v.问；请求，要求；邀
请","Jane asked her father why he hadn't
asked about her college life.","简问她父亲为什么不询问她的大学生活
情况。",,
112,asleep,[əˈsli:p],a.睡着的，熟睡的,He is fast asleep.,他睡得很熟。,,
113,aspect,[ˈæspekt],n.面貌，外表；方面,"Tangshan takes on an entirely new
aspect.",唐山市面貌一新。,,
114,assess,[ə'ses],vt.估价；评价,"The value of this property was assessed
at one million dollars.",这份财产的价值估定为 100 万美元。,,
115,assistant,[əˈsɪstənt],n.助手，助理,"He paid the shop assistant five dollars for
the gift.",他支付给售货员 5 美元来买这件礼物。,,
116,association,[əˌsəʊʃiˈeɪʃn],"n.协会，团体；联会，
交往；联想，联系","Have you joined the football
association?",你加入足球协会了吗？,,
117,astonish,[əˈstɒnɪʃ],vt.使惊讶,The news astonished everyone.,这个消息使大家十分惊讶。,,
118,atmosphere,[ˈætməsfɪə(r)],"n.[the~]大气；空气；
[sing.]气氛","The top leaders of the two countries are
holding talks in a friendly atmosphere.","两国高层领导人正在友好的气氛中进行
会谈。",,
119,attach,[əˈtætʃ],"vt.(to)系/贴/附上；重
视，认为……很重要","Parents attach much importance to
education.",父母认为教育很重要。,,
120,attack,[əˈtæk],"vt./n.攻击，袭击；（疾
病）侵袭","A woman was attacked and robbed by
a gang of youths.","一位妇女遭到了一伙年轻人袭击和抢
劫。",,
121,attempt,[əˈtempt],vt./n.试图；尝试,"The prisoners attempted an escape, but
failed.",囚犯企图逃跑，但失败了。,,
122,attend,[əˈtend],"v.出席，参加；（to）
专心，注意；照顾","I often attend meetings and sometimes I
take part in the discussion.","我经常出席会议，有时参加（大会的）
讨论。",,
123,attention,[əˈtenʃn],n.注意（力）；关心,Her smile caught my attention.,她的微笑引起了我的注意。,,
124,attitude,[ˈætɪtju:d],"n.（to，towards）态
度，看法",He has a positive attitude to work.,他工作态度积极。,,
125,attract,[əˈtrækt],vt.吸引，引起（兴趣）,"Thousands of foreigners were attracted
to the Shanghai World Expo the day it
opened.","开放当天，成千上万的外国人被吸引到
上海世博会中来。",,
126,audience,[ˈɔ:diəns],n.听众，观众,"If you make a mistake, keep smiling so
the audience will not notice.","如果出错，你要保持微笑，这样观众就
不会注意到了。",,
127,author,[ˈɔ:θə(r)],n.作者,"Can you tell me who is the author of the
novel?",你能告诉我这本小说的作者是谁吗？,,
128,available,[əˈveɪləbl],"a.（物）可用的，可得
到的；（人）可见到
的，有空的","These dresses are not available in your
size, I'm afraid.",恐怕这些衣服没有你的尺寸。,,
129,average,[ˈævərɪdʒ],"a.平均的；普通的 n.平
均数；平均水平","Average earnings are around twenty
thousand pounds per year.",年均收入约为两万英镑。,,
130,awake,[əˈweɪk],"vi.醒来 vt.唤醒 a.醒着
的",It was midday when she awoke.,她醒来时已是正午了。,,
131,award,[əˈwɔ:d],"n.奖；奖品；奖金 vt.授
予","He was awarded the prize for being the
fastest runner.",他因跑得最快而得奖。,,
132,aware,[əˈweə(r)],"a.[表语]（of）意识到
的，知道的","Most smokers are aware of the danger
of smoking.",大多数吸烟者知道吸烟的危害。,,
133,away,[əˈweɪ],ad.离开；在/到远处,The beach is a mile away.,海滩在一英里外。,,
134,awful,[ˈɔ:fl],"a.可怕的；糟糕的；极
度的",It was an awful sight.,那是个可怕的情景。,,
135,back,[bæk],"n.背部；后面；背面 ad.
回（原处）；向后 a.后
面的",He lay on his back.,他仰躺着。,,
136,background,ˈbækgraʊnd],n.背景,"Do you like the background music of this
film?",你喜欢这部电影的背景音乐吗？,,
137,bad,bæd],"a.坏的；有害的，不利
的；严重的",Smoking is bad for your health.,吸烟有害健康。,,
138,badly,[ˈbædli],"ad.差，拙劣地；严重
地；非常","The company has been very badly
managed.",这家公司的管理非常差。,,
139,baggage,[ˈbægɪdʒ],"n.（AmE)行李
[=(BrE)luggage]",How much baggage do you have?,你有多少行李?,,
140,balance,[ˈbæləns],"n.平衡；天平；差额，
余数 vt.使平衡",I lost my balance and fell on my face.,我失去平衡，脸着地摔倒了。,,
141,balloon,[bəˈlu:n],n.气球,The balloon floated off in the west.,气球向西方飘去。,,
142,ban,[bæn],vt.取缔，禁止 n.禁令,"He was banned from attending the
meeting.",他被禁止参加会议。,,
143,bank,[bæŋk],n.岸，堤；银行,"Our school is on the right bank of the
river.",我们学校位于河的右岸。,,
144,bar,[bɑ:(r)],n.酒吧；柜台；条，棒,He sat at the bar.,他坐在吧台旁边。,,
145,bare,[beə(r)],"a.赤裸的，光秃的；空
的；仅有的，稀少的 vt.
露出，暴露",I saw him running with bare feet.,我看见他在赤脚跑步。,,
146,bargain,[ˈbɑ:gən],"vi.讨价还价 n.廉价货；
协议，交易","I bought a dress for only ten dollars in a
sale; it was a real bargain.","我在一次打折销售时花 10 美元买了一
件衣服，真是物超所值。",,
147,base,[beɪs],"n.根基；基地 vt.（on，
upon）把……基于……，
以……为基础","Based on the idea above, the navigating
compass was invented.",基于以上想法，人们发明了航海罗盘。,,
148,bathe,[beɪð],v.洗澡,Have you bathed the baby yet?,你给婴儿洗澡了吗？,,
149,battle,[ˈbætl],n.战役，战斗,"Weeks went by, and the battle went on.",几个星期过去了，战斗仍在进行。,,
150,be,[bi],v.是；成为,"Don't be late for class, please.",请不要上课迟到。,,
151,bear,[beə(r)],"n.熊(bore,borne) v.忍
受，容忍；负担，承担","She couldn't bear his visiting her
together with a big white bear.","她不能忍受他和一头大白熊一起来拜访
他。",,
152,beard,[bɪəd],n.（下巴上的）胡须,"The police are searching for a tall dark
man with a beard.","警察正在搜寻一名肤色黝黑、留胡子的
高个男子。",,
153,beat,[bi:t],"v.（心脏等）跳动；敲
打；打败 n.敲打
（声）；节拍",The boy beat the drum for over an hour.,这个男孩打鼓打了一个多小时。,,
154,beauty,[ˈbju:ti],n.美；美人,Beauty is in the eye of the beholder.,[谚]情人眼里出西施。,,
155,because,[bɪˈkɒz],conj.因为,He is absent today because of his illness.,他今天缺席，因为他病了。,,
156,become,[bɪˈkʌm],vi.变得；成为,The actor became famous overnight.,那位演员一下子成了名。,,
157,before,[bɪˈfɔ:(r)],"prep./conj.在……之前；
在……前面 ad.以前","You can't borrow books from the school
library before you get your student card.","在拿到学生证之前，你不能从图书馆借
书。",,
158,beg,[beg],v.请求；乞求，乞讨,"The man begged money from passers-
by.",那男子向过路人要钱。,,
159,begin,[bɪˈgɪn],v.开始,The meeting begins at 10:30 am.,会议上午十点半开始。,,
160,behave,[bɪˈheɪv],v.表现，举止；守规矩,"Children should be taught how to
behave towards adults.",孩子应该被教会如何对待成人。,,
161,believe,[bɪˈli:v],v.相信；认为,"I don't believe that everyone believes in
God.",我相信，并非每个人都信仰上帝。,,
162,belong,[bɪˈlɒŋ],vi.属于,Lions and tigers belong to cat family.,狮子和老虎属于猫科动物。,,
163,below,[bɪˈləʊ],prep.在……以下,He is below the average at school.,他的学习成绩在中等以下。,,
164,bend,[bend],"v.（使）弯曲；（使）
屈服","Bend your legs when you pick up
something.",捡东西时要屈腿。,,
165,benefit,[ˈbenɪfɪt],"n.利益，好处 vt.有益
于，使受益 vi.得益","The new highway will benefit the
villagers.",新公路会对村民有益。,,
166,beside,[bɪˈsaɪd],prep.在……旁边；靠近,There's a lamp beside the bed.,床旁边有一盏灯。,,
167,besides,[bɪˈsaɪdz],"prep.除……之外（还
有） ad.还有，此外","We all went there except him last time.
This time we'll all go besides him.","上次除他没去外，我们都去了。这次除
他去以外，我们也都将去那里。",,
168,best,[best],"a./ad.最好的/地
n.[the~]最好的人/物","Good, better, best; never let it rest, till
good is better, and better best.","好，更好，最好；永远不要停歇，直到
好成为更好，更好成为最好。",,
